{
  "schemaVersion": "nimi.local-agent-product-journey-result/v2",
  "journeyTrialId": "dev-kernel-core:L2:core:1",
  "journeyId": "dev-kernel-core",
  "tier": "L2",
  "batch": "core",
  "repeatIndex": 1,
  "sourceState": {
    "nimiCommit": "1111111111111111111111111111111111111111",
    "nimiSourceTreeSha256": "2121212121212121212121212121212121212121212121212121212121212121",
    "sourceDigest": "2020202020202020202020202020202020202020202020202020202020202020"
  },
  "environmentIdentity": {
    "rootId": "synthetic-isolated-dev-kernel-root-0001",
    "accountIds": ["synthetic-primary", "synthetic-secondary"],
    "runtimeSourceRefs": ["synthetic-runtime-source"],
    "localAgentIds": ["synthetic-local-agent"],
    "processStarts": {"provider": 1, "realm": 1, "runtime": 1, "desktop": 1, "zhiyu": 1}
  },
  "durationMs": 1000,
  "checkpoints": [
    {"checkpointId":"fixed-service-ready","prerequisiteIds":[],"startedAt":"2026-07-13T00:00:00.000Z","completedAt":"2026-07-13T00:00:01.000Z","correlations":{"journeyTrialId":"dev-kernel-core:L2:core:1"},"assertions":[{"assertionId":"fixture.fixed-service-ready","outcome":"passed"}],"artifactRefs":["fixed-service-summary"],"outcome":"passed"},
    {"checkpointId":"production-account-login","prerequisiteIds":["fixed-service-ready"],"startedAt":"2026-07-13T00:00:01.000Z","completedAt":"2026-07-13T00:00:02.000Z","correlations":{"journeyTrialId":"dev-kernel-core:L2:core:1"},"assertions":[{"assertionId":"fixture.production-account-login","outcome":"passed"}],"artifactRefs":["dev-kernel-journey-summary"],"outcome":"passed"},
    {"checkpointId":"developer-mode-enabled","prerequisiteIds":["production-account-login"],"startedAt":"2026-07-13T00:00:02.000Z","completedAt":"2026-07-13T00:00:03.000Z","correlations":{"journeyTrialId":"dev-kernel-core:L2:core:1"},"assertions":[{"assertionId":"fixture.developer-mode-enabled","outcome":"passed"}],"artifactRefs":["dev-kernel-journey-summary"],"outcome":"passed"},
    {"checkpointId":"run-once-project-admitted","prerequisiteIds":["developer-mode-enabled"],"startedAt":"2026-07-13T00:00:03.000Z","completedAt":"2026-07-13T00:00:04.000Z","correlations":{"journeyTrialId":"dev-kernel-core:L2:core:1"},"assertions":[{"assertionId":"fixture.run-once-project-admitted","outcome":"passed"}],"artifactRefs":["journey-checkpoint-proof"],"outcome":"passed"},
    {"checkpointId":"zero-grant-session","prerequisiteIds":["run-once-project-admitted"],"startedAt":"2026-07-13T00:00:04.000Z","completedAt":"2026-07-13T00:00:05.000Z","correlations":{"journeyTrialId":"dev-kernel-core:L2:core:1"},"assertions":[{"assertionId":"fixture.zero-grant-session","outcome":"passed"}],"artifactRefs":["journey-checkpoint-proof"],"outcome":"passed"},
    {"checkpointId":"operation-denied-before-grant","prerequisiteIds":["zero-grant-session"],"startedAt":"2026-07-13T00:00:05.000Z","completedAt":"2026-07-13T00:00:06.000Z","correlations":{"journeyTrialId":"dev-kernel-core:L2:core:1"},"assertions":[{"assertionId":"fixture.operation-denied-before-grant","outcome":"passed"}],"artifactRefs":["journey-checkpoint-proof"],"outcome":"passed"},
    {"checkpointId":"selected-operation-granted","prerequisiteIds":["operation-denied-before-grant"],"startedAt":"2026-07-13T00:00:06.000Z","completedAt":"2026-07-13T00:00:07.000Z","correlations":{"journeyTrialId":"dev-kernel-core:L2:core:1"},"assertions":[{"assertionId":"fixture.selected-operation-granted","outcome":"passed"}],"artifactRefs":["journey-checkpoint-proof"],"outcome":"passed"},
    {"checkpointId":"selected-runtime-agent-operation","prerequisiteIds":["selected-operation-granted"],"startedAt":"2026-07-13T00:00:07.000Z","completedAt":"2026-07-13T00:00:08.000Z","correlations":{"journeyTrialId":"dev-kernel-core:L2:core:1"},"assertions":[{"assertionId":"fixture.selected-runtime-agent-operation","outcome":"passed"}],"artifactRefs":["provider-capture-summary"],"outcome":"passed"},
    {"checkpointId":"process-mismatch-denied","prerequisiteIds":["selected-runtime-agent-operation"],"startedAt":"2026-07-13T00:00:08.000Z","completedAt":"2026-07-13T00:00:09.000Z","correlations":{"journeyTrialId":"dev-kernel-core:L2:core:1"},"assertions":[{"assertionId":"fixture.process-mismatch-denied","outcome":"passed"}],"artifactRefs":["journey-checkpoint-proof"],"outcome":"passed"},
    {"checkpointId":"grant-revoked-next-operation-denied","prerequisiteIds":["process-mismatch-denied"],"startedAt":"2026-07-13T00:00:09.000Z","completedAt":"2026-07-13T00:00:10.000Z","correlations":{"journeyTrialId":"dev-kernel-core:L2:core:1"},"assertions":[{"assertionId":"fixture.grant-revoked-next-operation-denied","outcome":"passed"}],"artifactRefs":["journey-checkpoint-proof"],"outcome":"passed"},
    {"checkpointId":"remembered-project-admitted","prerequisiteIds":["grant-revoked-next-operation-denied"],"startedAt":"2026-07-13T00:00:10.000Z","completedAt":"2026-07-13T00:00:11.000Z","correlations":{"journeyTrialId":"dev-kernel-core:L2:core:1"},"assertions":[{"assertionId":"fixture.remembered-project-admitted","outcome":"passed"}],"artifactRefs":["journey-checkpoint-proof"],"outcome":"passed"},
    {"checkpointId":"runtime-agent-conversation","prerequisiteIds":["remembered-project-admitted"],"startedAt":"2026-07-13T00:00:11.000Z","completedAt":"2026-07-13T00:00:12.000Z","correlations":{"journeyTrialId":"dev-kernel-core:L2:core:1"},"assertions":[{"assertionId":"fixture.runtime-agent-conversation","outcome":"passed"}],"artifactRefs":["provider-capture-summary"],"outcome":"passed"},
    {"checkpointId":"edit-build-process-replaced","prerequisiteIds":["runtime-agent-conversation"],"startedAt":"2026-07-13T00:00:12.000Z","completedAt":"2026-07-13T00:00:13.000Z","correlations":{"journeyTrialId":"dev-kernel-core:L2:core:1"},"assertions":[{"assertionId":"fixture.edit-build-process-replaced","outcome":"passed"}],"artifactRefs":["process-summary"],"outcome":"passed"},
    {"checkpointId":"conversation-resumed-after-process-replacement","prerequisiteIds":["edit-build-process-replaced"],"startedAt":"2026-07-13T00:00:13.000Z","completedAt":"2026-07-13T00:00:14.000Z","correlations":{"journeyTrialId":"dev-kernel-core:L2:core:1"},"assertions":[{"assertionId":"fixture.conversation-resumed-after-process-replacement","outcome":"passed"}],"artifactRefs":["dev-kernel-journey-summary"],"outcome":"passed"},
    {"checkpointId":"mode-off-dormant","prerequisiteIds":["conversation-resumed-after-process-replacement"],"startedAt":"2026-07-13T00:00:14.000Z","completedAt":"2026-07-13T00:00:15.000Z","correlations":{"journeyTrialId":"dev-kernel-core:L2:core:1"},"assertions":[{"assertionId":"fixture.mode-off-dormant","outcome":"passed"}],"artifactRefs":["journey-checkpoint-proof"],"outcome":"passed"},
    {"checkpointId":"remembered-project-reactivated","prerequisiteIds":["mode-off-dormant"],"startedAt":"2026-07-13T00:00:15.000Z","completedAt":"2026-07-13T00:00:16.000Z","correlations":{"journeyTrialId":"dev-kernel-core:L2:core:1"},"assertions":[{"assertionId":"fixture.remembered-project-reactivated","outcome":"passed"}],"artifactRefs":["journey-checkpoint-proof"],"outcome":"passed"},
    {"checkpointId":"fixed-service-restarted","prerequisiteIds":["remembered-project-reactivated"],"startedAt":"2026-07-13T00:00:16.000Z","completedAt":"2026-07-13T00:00:17.000Z","correlations":{"journeyTrialId":"dev-kernel-core:L2:core:1"},"assertions":[{"assertionId":"fixture.fixed-service-restarted","outcome":"passed"}],"artifactRefs":["fixed-service-summary","process-summary"],"outcome":"passed"},
    {"checkpointId":"conversation-resumed-after-runtime-restart","prerequisiteIds":["fixed-service-restarted"],"startedAt":"2026-07-13T00:00:17.000Z","completedAt":"2026-07-13T00:00:18.000Z","correlations":{"journeyTrialId":"dev-kernel-core:L2:core:1"},"assertions":[{"assertionId":"fixture.conversation-resumed-after-runtime-restart","outcome":"passed"}],"artifactRefs":["dev-kernel-journey-summary"],"outcome":"passed"},
    {"checkpointId":"account-switch-invalidated","prerequisiteIds":["conversation-resumed-after-runtime-restart"],"startedAt":"2026-07-13T00:00:18.000Z","completedAt":"2026-07-13T00:00:19.000Z","correlations":{"journeyTrialId":"dev-kernel-core:L2:core:1"},"assertions":[{"assertionId":"fixture.account-switch-invalidated","outcome":"passed"}],"artifactRefs":["journey-checkpoint-proof"],"outcome":"passed"},
    {"checkpointId":"project-revoked-next-operation-denied","prerequisiteIds":["account-switch-invalidated"],"startedAt":"2026-07-13T00:00:19.000Z","completedAt":"2026-07-13T00:00:20.000Z","correlations":{"journeyTrialId":"dev-kernel-core:L2:core:1"},"assertions":[{"assertionId":"fixture.project-revoked-next-operation-denied","outcome":"passed"}],"artifactRefs":["journey-checkpoint-proof"],"outcome":"passed"},
    {"checkpointId":"desktop-real-shell-acceptance","prerequisiteIds":["project-revoked-next-operation-denied"],"startedAt":"2026-07-13T00:00:20.000Z","completedAt":"2026-07-13T00:00:21.000Z","correlations":{"journeyTrialId":"dev-kernel-core:L2:core:1"},"assertions":[{"assertionId":"fixture.desktop-real-shell-acceptance","outcome":"passed"}],"artifactRefs":["real-shell-dom-console-a11y","real-shell-desktop-screenshot"],"outcome":"passed"},
    {"checkpointId":"zhiyu-real-shell-acceptance","prerequisiteIds":["project-revoked-next-operation-denied"],"startedAt":"2026-07-13T00:00:20.000Z","completedAt":"2026-07-13T00:00:21.000Z","correlations":{"journeyTrialId":"dev-kernel-core:L2:core:1"},"assertions":[{"assertionId":"fixture.zhiyu-real-shell-acceptance","outcome":"passed"}],"artifactRefs":["real-shell-dom-console-a11y","real-shell-narrow-screenshot"],"outcome":"passed"},